<?xml version="1.0" encoding="UTF-8"?>
<!--Sample XML file generated by XMLSpy v2021 (x64) (http://www.altova.com)-->
<ladr:LadrApplicationMessage xmlns:fb="http://www.fixm.aero/base/4.2" xmlns:fx="http://www.fixm.aero/flight/4.2" xmlns:xsi="http://www.w3.org/2001/XMLSchema-instance" xmlns:ladr="http://www.eurocontrol.int/nm/fixm/app/ladr/1.0" xsi:schemaLocation="http://www.eurocontrol.int/nm/fixm/app/ladr/1.0 ../../schemas/distressEventUploadValidationMessage/ladrmessage/LadrApplicationMessage.xsd">
	<ladr:metadata>
	    <!--TO BE DISCUSSED :  identifier of a message -->		
		<ladr:identifier codeSpace="urn:uuid">7f79eaf3-3053-48b6-b699-293d54ee0d67</ladr:identifier>
		<!--TO BE DISCUSSED :  temporality associated with LADR messages and what needs to be exchanged -->	
		<ladr:timestamp>2022-01-19T06:00:15Z</ladr:timestamp>
		<ladr:receiptTime>2022-01-19T06:00:15Z</ladr:receiptTime>		
		<ladr:type>DISTRESS_EVENT_UPLOAD_VALIDATION_MESSAGE</ladr:type>
		<ladr:validationStatus>NOT_VALID</ladr:validationStatus>
		<ladr:referencedMessageIdentifier codeSpace="urn:uuid">eca23996-df29-4ee2-a886-bf8f150a75a4</ladr:referencedMessageIdentifier>
		<ladr:tunv>2022-01-19T06:00:13Z</ladr:tunv>
		<ladr:tval>2022-01-19T06:00:14Z</ladr:tval>
	</ladr:metadata>
</ladr:LadrApplicationMessage>
